{"asset":{"kind":"curated","path":"dataset/retrieval/exemplars/curated-01.png","sha256":"0000000000000000000000000000000000000000000000000000000000000000"},"pattern":{"composition_structure":{"hierarchy":["display","section","supporting"],"negative_patterns":["centered-template","three-equal"],"zones":["identity","metadata","proof"]},"proof":"Real command output as the proof block.","structure":"Identity block left, proof right, metadata strip bottom.","summary":"Terminal motif hero with command rhythm."},"project_types":["developer-tool"],"record_id":"exemplar-curated-01","section_intents":["hero"],"source":{"commit":"0000000000000000000000000000000000000000","human_reviewed":true,"license_evidence_sha256":"0000000000000000000000000000000000000000000000000000000000000000","license_evidence_spdx":"MIT","license_evidence_url":"https://github.com/example/repo/blob/0/LICENSE","license_spdx":"MIT","material_sha256":"0000000000000000000000000000000000000000000000000000000000000000","repository_url":"https://github.com/example/repo"},"split":"train","tags":["cli","terminal"]}
