{
  "record_id": "exemplar-curated-04",
  "project_types": [
    "developer-tool"
  ],
  "section_intents": [
    "hero"
  ],
  "tags": [
    "code-sample",
    "demo",
    "heading"
  ],
  "pattern": {
    "summary": "Title-then-proof: a statement heading above a code demonstration.",
    "structure": "A heading line occupies the top of the frame; a code block follows directly beneath it; small variable annotation boxes sit at the top-right.",
    "proof": "Proof is the executable code sample shown verbatim below the heading.",
    "composition_structure": {
      "zones": [
        "identity",
        "proof"
      ],
      "hierarchy": [
        "display",
        "section"
      ],
      "negative_patterns": [
        "centered-template",
        "screenshot-float",
        "text-wall"
      ]
    }
  },
  "asset": {
    "path": "dataset/retrieval/exemplars/curated-04.png",
    "sha256": "bc8322e0c8cbf1fb2f22d6b7c1b3b3aa8463a75b49d851651b29c456c06e16aa",
    "kind": "curated"
  },
  "source": {
    "repository_url": "https://github.com/pytorch/pytorch",
    "commit": "af55402990611787168cfabfb457c9d30f5a4d73",
    "material_sha256": "bc8322e0c8cbf1fb2f22d6b7c1b3b3aa8463a75b49d851651b29c456c06e16aa",
    "license_spdx": "BSD-3-Clause",
    "license_evidence_spdx": "BSD-3-Clause",
    "license_evidence_url": "https://github.com/pytorch/pytorch/blob/af55402990611787168cfabfb457c9d30f5a4d73/LICENSE",
    "license_evidence_sha256": "bd018feef8825e88181c84eb7e3aa4eafb8f08a20d9fd6ef948569610c4a3e43",
    "human_reviewed": true
  },
  "split": "train"
}
